{
  "input1": {
    "id": "1AKE",
    "source": "pdb_id",
    "model_id": 1
  },
  "input2": {
    "id": "4AKE",
    "source": "pdb_id",
    "model_id": 2
  },
  "matchmaker": {
    "reference_model": 1,
    "moved_model": 2,
    "full_rmsd": 8.240263184004824,
    "final_rmsd": 1.082836956871242,
    "n_full_pairs": 214,
    "n_final_pairs": 112,
    "per_chain": [
      {
        "n_full": 214,
        "n_final": 112,
        "full_rmsd": 8.240263184004824,
        "final_rmsd": 1.082836956871242
      }
    ]
  },
  "chains": [
    {
      "chain_id": "A",
      "model": 1,
      "residues": [
        {
          "chain_id": "A",
          "res_num": 1,
          "res_name": "MET",
          "ca_coord": [
            26.091,
            52.849000000000004,
            39.889
          ],
          "sasa": 55.085079858829076,
          "ss_type": "E",
          "altloc_ids": [],
          "max_occupancy": 1.0
        },
        {
          "chain_id": "A",
          "res_num": 2,
          "res_name": "ARG",
          "ca_coord": [
            27.437,
            49.969,
            37.786
          ],
          "sasa": 38.63355252694037,
          "ss_type": "E",
          "altloc_ids": [],
          "max_occupancy": 1.0
        },
        {
          "chain_id": "A",
          "res_num": 3,
          "res_name": "ILE",
          "ca_coord": [
            24.961000000000002,
            47.988,
            35.671
          ],
          "sasa": -1.0462659554108956e-13,
          "ss_type": "E",
          "altloc_ids": [],
          "max_occupancy": 1.0
        },
        {
          "chain_id": "A",
          "res_num": 4,
          "res_name": "ILE",
          "ca_coord": [
            25.194,
            44.925000000000004,
            33.36
          ],
          "sasa": -1.0462659554108956e-13,
          "ss_type": "E",
          "altloc_ids": [],
          "max_occupancy": 1.0
        },
        {
          "chain_id": "A",
          "res_num": 5,
          "res_name": "LEU",
          "ca_coord": [
            22.428,
            44.503,
            30.712
          ],
          "sasa": -1.0462659554108956e-13,
          "ss_type": "E",
          "altloc_ids": [],
          "max_occupancy": 1.0
        },
        {
          "chain_id": "A",
          "res_num": 6,
          "res_name": "LEU",
          "ca_coord": [
            21.933,
            40.811,
            29.752
          ],
          "sasa": -1.0462659554108956e-13,
          "ss_type": "E",
          "altloc_ids": [],
          "max_occupancy": 1.0
        },
        {
          "chain_id": "A",
          "res_num": 7,
          "res_name": "GLY",
          "ca_coord": [
            19.604,
            39.512,
            26.973
          ],
          "sasa": 0.02667753242396079,
          "ss_type": "C",
          "altloc_ids": [],
          "max_occupancy": 1.0
        },
        {
          "chain_id": "A",
          "res_num": 8,
          "res_name": "ALA",
          "ca_coord": [
            19.324,
            37.742,
            23.567
          ],
          "sasa": -3.645766007880427e-14,
          "ss_type": "C",
          "altloc_ids": [],
          "max_occupancy": 1.0
        },
        {
          "chain_id": "A",
          "res_num": 9,
          "res_name": "PRO",
          "ca_coord": [
            20.108,
            39.651,
            20.294
          ],
          "sasa": -8.190361705366113e-14,
          "ss_type": "C",
          "altloc_ids": [],
          "max_occupancy": 1.0
        },
        {
          "chain_id": "A",
          "res_num": 10,
          "res_name": "GLY",
          "ca_coord": [
            17.487000000000002,
            42.426,
            19.756
          ],
          "sasa": -1.3734681591375843e-14,
          "ss_type": "C",
          "altloc_ids": [],
          "max_occupancy": 1.0
        },
        {
          "chain_id": "A",
          "res_num": 11,
          "res_name": "ALA",
          "ca_coord": [
            15.96,
            42.201,
            23.284
          ],
          "sasa": -3.645766007880427e-14,
          "ss_type": "C",
          "altloc_ids": [],
          "max_occupancy": 1.0
        },
        {
          "chain_id": "A",
          "res_num": 12,
          "res_name": "GLY",
          "ca_coord": [
            16.082,
            46.035000000000004,
            23.547
          ],
          "sasa": -1.3734681591375843e-14,
          "ss_type": "H",
          "altloc_ids": [],
          "max_occupancy": 1.0
        },
        {
          "chain_id": "A",
          "res_num": 13,
          "res_name": "LYS",
          "ca_coord": [
            19.303,
            46.427,
            25.595
          ],
          "sasa": -1.0103936357562255e-13,
          "ss_type": "H",
          "altloc_ids": [],
          "max_occupancy": 1.0
        },
        {
          "chain_id": "A",
          "res_num": 14,
          "res_name": "GLY",
          "ca_coord": [
            20.816,
            49.254,
            23.528000000000002
          ],
          "sasa": 4.203993621963434,
          "ss_type": "H",
          "altloc_ids": [],
          "max_occupancy": 1.0
        },
        {
          "chain_id": "A",
          "res_num": 15,
          "res_name": "THR",
          "ca_coord": [
            17.421,
            51.124,
            23.373
          ],
          "sasa": 0.26332748773845893,
          "ss_type": "H",
          "altloc_ids": [],
          "max_occupancy": 1.0
        },
        {
          "chain_id": "A",
          "res_num": 16,
          "res_name": "GLN",
          "ca_coord": [
            17.135,
            51.071,
            27.21
          ],
          "sasa": -5.0192341670180114e-14,
          "ss_type": "H",
          "altloc_ids": [],
          "max_occupancy": 1.0
        },
        {
          "chain_id": "A",
          "res_num": 17,
          "res_name": "ALA",
          "ca_coord": [
            20.821,
            51.825,
            27.722
          ],
          "sasa": -3.645766007880427e-14,
          "ss_type": "H",
          "altloc_ids": [],
          "max_occupancy": 1.0
        },
        {
          "chain_id": "A",
          "res_num": 18,
          "res_name": "GLN",
          "ca_coord": [
            20.249,
            55.314,
            26.080000000000002
          ],
          "sasa": 14.115295747879252,
          "ss_type": "H",
          "altloc_ids": [],
          "max_occupancy": 1.0
        },
        {
          "chain_id": "A",
          "res_num": 19,
          "res_name": "PHE",
          "ca_coord": [
            17.474,
            56.050000000000004,
            28.712
          ],
          "sasa": 5.80164104149565e-14,
          "ss_type": "H",
          "altloc_ids": [],
          "max_occupancy": 1.0
        },
        {
          "chain_id": "A",
          "res_num": 20,
          "res_name": "ILE",
          "ca_coord": [
            19.532,
            54.877,
            31.696
          ],
          "sasa": -1.0462659554108956e-13,
          "ss_type": "H",
          "altloc_ids": [],
          "max_occupancy": 1.0
        },
        {
          "chain_id": "A",
          "res_num": 21,
          "res_name": "MET",
          "ca_coord": [
            22.441,
            56.903,
            30.479
          ],
          "sasa": 30.24208139103378,
          "ss_type": "H",
          "altloc_ids": [],
          "max_occupancy": 1.0
        },
        {
          "chain_id": "A",
          "res_num": 22,
          "res_name": "GLU",
          "ca_coord": [
            20.467,
            60.117000000000004,
            30.02
          ],
          "sasa": 112.03219955472866,
          "ss_type": "H",
          "altloc_ids": [],
          "max_occupancy": 1.0
        },
        {
          "chain_id": "A",
          "res_num": 23,
          "res_name": "LYS",
          "ca_coord": [
            18.497,
            59.71,
            33.252
          ],
          "sasa": 81.8526555980325,
          "ss_type": "H",
          "altloc_ids": [],
          "max_occupancy": 1.0
        },
        {
          "chain_id": "A",
          "res_num": 24,
          "res_name": "TYR",
          "ca_coord": [
            21.269000000000002,
            58.502,
            35.566
          ],
          "sasa": 48.48706580054353,
          "ss_type": "H",
          "altloc_ids": [],
          "max_occupancy": 1.0
        },
        {
          "chain_id": "A",
          "res_num": 25,
          "res_name": "GLY",
          "ca_coord": [
            24.253,
            60.217,
            33.938
          ],
          "sasa": 33.677616468019764,
          "ss_type": "H",
          "altloc_ids": [],
          "max_occupancy": 1.0
        },
        {
          "chain_id": "A",
          "res_num": 26,
          "res_name": "ILE",
          "ca_coord": [
            26.346,
            56.989000000000004,
            33.707
          ],
          "sasa": 8.054797523271967,
          "ss_type": "C",
          "altloc_ids": [],
          "max_occupancy": 1.0
        },
        {
          "chain_id": "A",
          "res_num": 27,
          "res_name": "PRO",
          "ca_coord": [
            28.231,
            56.198,
            30.472
          ],
          "sasa": -8.190361705366113e-14,
          "ss_type": "E",
          "altloc_ids": [],
          "max_occupancy": 1.0
        },
        {
          "chain_id": "A",
          "res_num": 28,
          "res_name": "GLN",
          "ca_coord": [
            27.118000000000002,
            53.394,
            28.303
          ],
          "sasa": 8.423503370789952,
          "ss_type": "E",
          "altloc_ids": [],
          "max_occupancy": 1.0
        },
        {
          "chain_id": "A",
          "res_num": 29,
          "res_name": "ILE",
          "ca_coord": [
            30.122,
            51.105000000000004,
            27.381
          ],